Title,Text,url
"Trump plans executive order targeting ticket scalping, according to document","WASHINGTON, March 31 (Reuters) - President Donald Trump on Monday planned to sign an executive order aimed at protecting fans from ""exploitative ticket scalping"" and reforming the U.S. live entertainment ticketing industry, according to a White House fact sheet seen by Reuters.
The order directs Treasury Secretary Scott Bessent and U.S. Attorney General Pam Bondi to ensure that ticket scalpers are in full compliance with the tax-collecting Internal Revenue Service and other applicable law, the fact sheet said.
The order directs the Federal Trade Commission to work with the U.S. attorney to ensure that competition laws are appropriately enforced in the concert and entertainment industry, it said.
In January, U.S. senatorsassailedLive Nation Entertainment's lack of transparency and inability to block bot purchases of tickets, in a hearing called after a major fiasco involving ticket sales for a Taylor Swift concert tour.
Live Nation Entertainment Inc's subsidiary Ticketmaster, which has been unpopular with fans for years, has drawn fresh heat from U.S. lawmakers over how it handled ticket sales last fall for Swift's ""Eras"" tour, her first in five years.
Experts say Ticketmaster commands more than a 70% market share of primary ticket services for major U.S. concert venues.
The fact sheet singled out bot sales in particular.
""Ticket scalpers use bots and other unfair means to acquire large quantities of face-value tickets, then re-sell them at an enormous markup on the secondary market, price-gouging consumers and depriving fans of the opportunity to see their favorite artists without incurring extraordinary expenses,"" it said.",https://www.reuters.com/world/us/trump-plans-executive-order-targeting-ticket-scalping-according-document-2025-03-31/
Explainer: Can Donald Trump serve a third term as US president?,"March 31 (Reuters) - PresidentDonald Trumpsaid on Sunday he wasnot jokingabout seeking a third term but did not explain how he would get around the U.S. Constitution's prohibition against anyone serving more than two terms as president.
Here is a look at the legal barriers Trump faces.
The 22nd Amendment states in part: “No person shall be elected to the office of the President more than twice.”
The amendment was ratified in 1951 after President Franklin D. Roosevelt broke with a self-imposed two-termlimit set by presidentssince George Washington, the nation’s first.
Roosevelt, a Democrat who was president during the Great Depression and World War Two, served a third term and then died months into his fourth term in 1945.
Yes, but that is highly unlikely in an era of intense political polarization between Democrats and Trump’s Republican Party.
Any constitutional amendment would require two-thirds support in the House and Senate or a convention called by two-thirds of the states, and then ratification by 38 of the 50 state legislatures.
Republicans hold a razor-thin 218-213 majority in the House and a 53-47 majority in the Senate. Republicans control 28 state legislatures.
Andy Ogles, a Republican U.S. representative from Tennessee and a strong Trump supporter, in January proposed amending the 22nd Amendment to allow people to serve three non-consecutive terms as president.
Since Trump's terms beginning in 2017 and in 2025 were non-consecutive, the amendment if passed would allow him to serve a third term starting in 2029.
In an interview with NBC, Trump said one possibility would be for his vice president, J.D. Vance, to run for president in 2028 with Trump as his vice presidential candidate.
Vance would then resign as president if he wins, paving the way for Trump to return to the White House.
But Trump is barred from running for vice president because he is not eligible to be president. The 12th Amendment to the U.S. Constitution reads, ""No person constitutionally ineligible to the office of President shall be eligible to that of Vice-President of the United States.""",https://www.reuters.com/world/us/can-donald-trump-serve-third-term-us-president-2025-03-31/
US Supreme Court leans toward Catholic group's bid for Wisconsin unemployment tax exemption,"WASHINGTON, March 31 (Reuters) - TheU.S. Supreme Courtappeared sympathetic on Monday toward a bid by an arm of a Catholic diocese in Wisconsin for areligious exemptionfrom the state's unemployment insurance tax in the latest religious rights case to reach the justices.
They heard arguments in an appeal by the Catholic Charities Bureau - a nonprofit corporation operating as the social ministry arm of the Catholic diocese in the city of Superior - and four entities that the bureau oversees of a lower court's decision rejecting their tax exemption bid.
At issue was whether Wisconsin's denial of the tax exemption violated the U.S. Constitution's First Amendment guarantee of free exercise of religion, as well as its separation of church and state. Under Wisconsin's unemployment insurance program, the state collects taxes from employers and uses the revenue to provide a temporary source of income to eligible jobless workers.
Lawyer Eric Rassbach, arguing for the Catholic Charities Bureau, urged the justices to embrace a ""generous approach to exemptions, not a stingy one."" A lawyer for PresidentDonald Trump's administration also argued in support of the challengers.
Wisconsin Assistant Attorney General Colin Roth told the justices that expanding the exemption as the plaintiffs seek could threaten jobless benefits for numerous currently covered employees nationwide who work for religiously affiliated employers.
""It would leave potentially over one million employees nationwide without unemployment coverage, like nurses and janitors at religiously affiliated hospitals,"" Roth said.
The federal government and all states exempt certain religious entities from having to pay into unemployment insurance programs. Most of these laws, including Wisconsin's, require that organizations be ""operated primarily for religious purposes"" to be eligible for a religious exemption.
The Wisconsin Supreme Court in 2024 rejected the tax exemption bid by Catholic Charities Bureau and its subsidiaries. Although the groups ""assert a religious motivation behind their work,"" that court found, their activities were ""primarily charitable and secular"" and thus were not ""operated primarily for religious purposes.""
The Catholic Charities Bureau since 1917, it said on its website, has provided ""services to the poor, the disadvantaged, the disabled, the elderly and children with special needs as an expression of the social ministry of the Catholic Church in the Diocese of Superior.""
Roth said Wisconsin's law is meant to prevent state officials who are handling unemployment disputes from having to involve the government in questions of religious doctrine. Some of the justices pressed Roth on whether that policy would benefit religious denominations and groups that proselytize and seek to inculcate their religion over those that do not.
""Isn't it a fundamental premise of our First Amendment that the state shouldn't be picking and choosing between religions?"" asked conservative Justice Neil Gorsuch.
""I thought it was pretty fundamental that we don't treat some religions better than other religions, and we certainly don't do it based on the content of the religious doctrine that those religions preach,"" liberal Justice Elena Kagan told Roth.
The Catholic Charities Bureau and its subsidiaries do not require their employees to be of any particular religion, nor do they seek to instill Catholic beliefs in those receiving their services. Among the subsidiary groups involved in the case are organizations that provide services to people with disabilities including job placements and training, as well as daily living services and home visitation, according to court papers.
During the Great Depression, Wisconsin in 1932 became the first U.S. state to enact an unemployment compensation law.
Three years later, Democratic U.S. President Franklin Roosevelt signed into law the landmark Social Security Act of 1935 that established, among other programs, a cooperative federal-state unemployment insurance plan that would eventually lead to all U.S. states enacting their own unemployment relief programs.
Some of the justices raised questions about the consequences of expanding the exemption, including whether a vegetarian restaurant owned by a religiously affiliated employer that does not believe in eating meat would get an exemption, and how the law would apply to religiously affiliated hospitals.
""There are lots of hard questions in this area - vegan restaurants, hospitals - lots of hard questions,"" Kagan said.
A ruling in the case is expected by the end of June.
The Supreme Court, with its 6-3 conservative majority, has taken an expansive view of religious rights in a series of rulings in recent years. The court on April 30 is due to hear another case involving Catholic interests in abidled by two Catholic dioceses to establish in Oklahoma the nation's first taxpayer-funded religious charter school in a case testing the separation of church and state.",https://www.reuters.com/world/us/us-supreme-court-hear-catholic-groups-bid-wisconsin-unemployment-tax-exemption-2025-03-31/
Musk gives away two $1 million checks to Wisconsin voters in high profile judicial race,"March 30 (Reuters) - BillionaireElon Muskon Sunday handed out million-dollar checks to two voters in Wisconsin and promised smaller payments to others who help elect a conservative candidate to the state's top court in a closely watched election.
The Tesla CEO, a top adviser to U.S. PresidentDonald Trump, handed out oversized checks at a rally in Green Bay as he sought to drum up enthusiasm for a state Supreme Court election that is already the most expensive judicial race in U.S. history.
Musk said he would also pay supporters $20 for every voter they recruit over the next two days.
He said he was spending the money to raise awareness of a race in which liberal Susan Crawford seems to be running ahead of conservative Brad Schimel.
""We actually are in serious danger of losing the election,"" he said. ""We've got to pull a rabbit out of a hat.""
The April 1 contest will determine the ideological tilt of the state's top court as it considers abortion rights, labor rights and possibly election rules. Technically nonpartisan, the race is seen as anearly referendum on Trumpin a politically competitive state.
Musk warned the court might redraw legislative districts in a way that could cause Trump's Republicans to lose seats in the U.S. House of Representatives.
""I think this will be important for the future of civilization. It's that significant,"" Musk said.
As of last week, groups affiliated with Musk had spent at least $17.5 million to support Schimel, according to New York University's Brennan Center for Justice -- more than one-fifth of the $81 million spent in total on the race.
Musk's $1 million giveaway echoed his tactics from the 2024 presidential election, when he gave checks to voters who signed petitions supporting conservative causes.
Wisconsin's attorney general, Democrat Josh Kaul, sued to block the giveaway but the state supreme court ruled it could go ahead, according to the Washington Post.
Musk spent more than $250 million to help elect Trump last year, far more than any other individual, and his appearance in Wisconsin showed his willingness to get involved in downballot races as well.
Trump has deputized Musk to oversee an unprecedented effort to slash the federal government that has effectively shuttered several agencies and fired tens of thousands of workers.",https://www.reuters.com/world/us/musk-gives-away-two-1-million-checks-wisconsin-voters-high-profile-judicial-race-2025-03-31/
Insight: How the Trump family took over a crypto firm as it raised hundreds of millions,"LONDON/NEW YORK, March 31 (Reuters) - As World Liberty Financial raised more than half a billion dollars, President Donald Trump’s family took control of the crypto venture and grabbed the lion’s share of those funds, aided by governance terms that industry experts say favor insiders.
Launched last fall, World Liberty’s goal is to allow people to access financial services using cryptocurrencies and without intermediaries like banks in what is called decentralized finance, or DeFi. But it has yet to launch a public platform and has reported only a small staff, a review of the project shows.
Even so, World Liberty said in mid-March it had raised $550 million selling so-called governance tokens. Most of those sales took place after Trump’s election win in November, Reuters calculations show.
The tokens, which go by the symbol $WLFI, give holders the right to vote on changes to the project’s underlying code and to signal their opinion on its direction and plans. They cannot be traded.
As its fundraising got traction, World Liberty disclosed in January that the Trump family had taken control of the business, a review of changes in the fine print on World Liberty’s website shows. Two of its co-founders, crypto entrepreneurs Zak Folkman and Chase Herro, were replaced as the controlling parties of World Liberty by an entity in which the Trump family holds a 60% stake.
The changes have not been previously reported.
Overall, the Trump family now has a claim on 75% of net revenues from token sales and 60% from World Liberty operations once the core business gets going. The arrangement means the Trump family is currently entitled to about $400 million in fees. After World Liberty's co-founders take their cut, the crypto venture will be left with 5% of the $550 million raised to date to build the platform, according to Reuters calculations.
The arrangements, including the Trump family’s large share of the project’s revenues and the non-tradeable nature of the governance tokens, make World Liberty unusually centralized for the industry, according to a survey of the practices of the five largest DeFi lending platforms and interviews with four U.S. academics who study the crypto industry.
""It's hard for me to see any economic benefit to the owner of these tokens,"" said Jim Angel, an associate professor at Georgetown University who has written about DeFi regulation.
David Krause, a longtime finance professor at Marquette University in Milwaukee who recently published a study of World Liberty, said that the structure of the project “pretty much excludes public investors or token holders from any meaningful financial participation.”
A White House spokesperson referred questions about World Liberty to the Trump Organization. The Trump Organization's chief legal officer and the president's two older sons, who are executives at the company, did not respond to requests for comment.
The Trump Organization announced in January that the president's investments, assets and business interests would be held in a trust managed by his children and he would play no role in day-to-day operations or decision-making. The family's business also retained an attorney to serve as an ethics adviser to ""avoid any perceived conflicts of interest.""
Folkman and Herro did not reply to Reuters questions in person and in writing. In a post on social media platform X on March 14, World Liberty said it “is a DeFi project with a tremendous mission to build and democratize a new financial system for the benefit of millions.”
At a conference in February, Herro said the plan was to open crypto investing to everyday Americans such as teachers, dentists and firemen. His business partner, Donald Trump Jr, the president's son, has complained about the family being excluded from traditional banking in the aftermath of his father's first term.
The Trump family’s investment in World Liberty ties the personal fortunes of a sitting U.S. president to an asset class that sits at the outer edges of both risk and regulation.
Trump has promised to be the “crypto president,” who will popularize its mainstream use in America. He has said he backs crypto because it can improve the banking system and increase the dominance of the U.S. dollar.
At the same time, the Trump family, long rooted in skyscrapers and country clubs, has opened beachheads in crypto, quickly gaining hundreds of millions of dollars. A so-called meme coin promoted by Trump has generated at least $349 million in fees for entities connected to the president, according to crypto data firm Chainalysis.
On Monday, the Trump family deepened its crypto interests, as a company formed with the president's elder sons, Eric and Donald Trump Jr., took a minority stake in a newly-formed bitcoin producer called American Bitcoin. Eric Trump will become the chief strategy officer of the new firm, which will focus on mining bitcoin and aims to become publicly listed, the statement said.
The prospect of Trump and his family benefiting from deregulation has drawn criticism from hispolitical opponentsand some government ethics experts who say it creates the potential for conflicts of interest and influence peddling.
""You've got the guy in charge who is responsible for his own regulation,"" said Ross Delston, a former U.S. banking regulator who has acted as an expert witness on anti-money laundering issues for the government.
Delston also pointed to the potential for people buying $WLFI tokens to earn political favor. It would be “the perfect vehicle,” he said, for governments or oligarchs overseas “to funnel money to the president.""
World Liberty has attracted well-heeled buyers: Almost 70% of the money raised came from wallets that spent at least $100,000, and more than 50% was buys of $1 million or more, according to a Reuters analysis of publicly available information on transactions.
While buyers of $WLFI gave their names to the venture, the identity of nearly all of those big spenders is hidden from public view by anonymous crypto wallets. Among ahandful of buyers that Reuters was able to identify,several said they bought into the token because they believed Trump’s involvement would help it succeed as a business.
World Liberty’s beginnings lie in the convergence of two obscure figures on the crypto scene and some of the most powerful people in American politics.
Folkman and Herro entered Trump circles via the family of New York real estate mogul Steve Witkoff, a longtime Trump friend who is now also his envoy to the Mideast.
The two crypto entrepreneurs had already collaborated on several companies together focused on making money from online ventures. Their business background includes past instances of dissolution, litigation and unpaid debts, according to corporate records, state filings and U.S. court documents. Early in his career, Folkman offered seminars on how to “date hotter girls.”
Steve Witkoff said he was introduced to the pair by one of his sons, when speaking about how the deal came together on a crypto podcast hosted in September by the Trump family.
After meeting the two crypto businessmen and hearing them speak about the difficulties of getting credit in traditional finance, Witkoff said he thought of the Trumps. He set up a meeting with Donald Trump and his two oldest sons for Herro and Folkman to describe the opportunities of DeFi. The Trumps, Witkoff said, were smitten: “We said, ‘Let’s go pursue it.’”
Witkoff did not respond to requests for comment.
Despite Trump’s backing, token sales were slow at first. According to a U.S. regulatory filing by the company dated October 30 - around two weeks after World Liberty sales had begun - the venture’s total amount sold was only $2.7 million.
Then, on November 25, less than three weeks after Trump won the U.S. election, Justin Sun, a Hong Kong-based crypto entrepreneur who was fighting a U.S. securities fraud lawsuit, announced that he’d sunk $30 million into $WLFI - the amount the company said it needed to jumpstart operations.
“His amount was pretty meaningful at that point,” said “Ogle”, a World Liberty security adviser who only goes by that pseudonym and has appeared in video interviews with his face obscured by a bandana and sunglasses.
Sun has said his investment has since risen to $75 million. As well as its single-largest known investor, he has become an advisor to the project. Meanwhile, the U.S. Securities and Exchange Commission in February paused its case against him, citing public interest.
Sun didn’t respond to a request for comment. The SEC declined to comment.
Initially, Herro and Folkman were listed as the “sole directors and members” of World Liberty Financial Inc, the main entity developing the platform, according to World Liberty’s terms and conditions, last updated in October.
On January 19 and 20 - the day of Trump’s inauguration - World Liberty raised almost $300 million in a frenzy of token sales, according to a Reuters analysis of blockchain data. Around that time, its website was updated to say WLF Holdco LLC now controlled World Liberty Financial Inc. And DT Marks DeFi LLC – Trump’s company – now held about 60% of WLF Holdco. It did not disclose who owns the rest.
The president’s son, Eric, also gained a seat on WLF Holdco’s board of managers.
Reuters could not ascertain the terms of any deals between Trump and his partners that led to the changes.
Angel, the Georgetown professor, said the corporate structure had put several layers of entities between Trump and World Liberty, protecting the president from any potential legal action should something go wrong. “He can say: ‘You can't sue me because I'm not involved’,” Angel said.
The five largest DeFi lending platforms, as ranked by data site DefiLlama, all have governance tokens that give holders voting rights. But unlike World Liberty, those five platforms either allocated the majority of their governance tokens to be given away for free to users, sold them to venture capitalists in return for money to build the platform, or paid them to partners in return for building the project.
World Liberty governance tokens lack another critical feature of those issued by other DeFi platforms – the ability of token holders to vote for the platform to pay them a share of its profits. World Liberty has told token holders any vote to breach its existing deals with Trump and other backers would have no force, according to a 13-page description of the business released in October.
Folkman told a New York audience on March 18 that the company is working on three main products, including a “lend and borrow” market that would be announced soon and a personal finance application. World Liberty also said in March that it is planning tolaunch a stablecoin, known as USD1, that will be backed by assets such as U.S. Treasuries and redeemable for a dollar.
One company that World Liberty has collaborated with is Ondo Finance. The startup, founded in 2021 by former Goldman Sachs employees, lets users buy blockchain-based tokens backed by U.S. Treasuries and other assets such as money market funds, thereby earning interest. The two companies said in a statement that they would collaborate to “advance the adoption of tokenized real-world assets.”
“They're all in early stages, but we're exploring what they're doing at a very high level,” Nathan Allman, Ondo’s CEO, told Reuters.
While World Liberty has also used some of the money it raisedto invest in other cryptocurrencies, it has yet to launch a DeFi platform.
Two software developers listed on World Liberty's website are based in Romania, according to their social media profiles. Octavian Lojnita was previously a developer at Dough Finance, a Herro and Folkman project that collapsed last year after being hacked, according to Lojnita's online profile and the publicly available source code of Dough. The online handle for a second developer at Dough matches that of Bogdan Purnavel, also at World Liberty.
Lojnita declined to discuss his involvement in World Liberty. Purnavel referred questions to World Liberty.
The coding for contracts posted to the project’s blockchain – a public-facing database – shows that World Liberty “appears to still be in development, with several functionalities not yet implemented or fully operational,” according to a review in late March by CertiK, a cybersecurity company that audits projects for security flaws.",https://www.reuters.com/business/finance/how-trump-family-took-over-world-liberty-financial-it-raised-hundreds-millions-2025-03-31/
