Title,Text,url
All of Trump’s tariffs and threatened trade actions,"March 31 (Reuters) - U.S. President DonaldTrumphas made numerous tariff threats since returning to office on January 20, ranging from a universal duty on imports to targeted tariffs on specific sectors or countries, in a bid to get others to meet his policy demands.
Trump's threats have changed over time, leaving other nations and businesses unclear about what is to come next and creating uncertainty for consumers, triggering a recent stock market selloff.
Here is a roundup of Trump's trade-related steps and threats.
A cornerstone of Trump's vision includes a phased rollout of universal tariffs on all U.S. imports.
Last month, Trump tasked his economics team with devising plans forreciprocal tariffson every country that taxes U.S. imports, as well as to counteract non-tariff barriers such as vehicle safety rules that exclude U.S. autos, and value-added taxes that increase their cost.
On March 30, Trump said he was planning to unveil amassive tariff plan, which he has called ""Liberation Day."" The reciprocal tariffs he is set to announce will include all nations.
Global trading partners' potential counter-tariffs targeting U.S. agricultural, energy and machinery exports could escalate into a worldwidetrade war, creating uncertainty for businesses and investors.
Trump's tariff proposals target several key trade partners; some are listed below.
MEXICO AND CANADA: The two countries were the largest trade partners of the U.S. in 2024 through November, with Mexico ranked first. Trump's new 25% tariffs on imports from Mexico and Canada took effect on March 4 as a retaliation for migration and fentanyl trafficking.
The tariffs included a 25% levy on most goods from Mexico and Canada, along with a 10% duty on energy imports from Canada. Canada primarily exports crude oil and other energy goods, as well as cars and auto parts within the North American auto manufacturing chain. Mexico also exports various goods to the U.S. in the industrial and auto sectors.
Canada hit back with 25% tariffs on C$30 billion ($20.7 billion) worth ofU.S. imports, including orange juice, peanut butter, beer, coffee, appliances and motorcycles.
The Canadian government added that it would impose additional tariffs on C$125 billion of U.S. goods if Trump's tariffs were still in place in 21 days, with the potential inclusion of vehicles, steel, aircraft, beef and pork.
Trump, in his March 4 address to Congress, said further tariffs would follow on April 2, including ""reciprocal tariffs"" and non-tariff actions to address trade imbalances.
U.S. Commerce Secretary Howard Lutnick said U.S. officials might still work out a partial resolution with the two neighbors, adding that they needed to do more on the fentanyl front.
Trump on March 11walked backplanned 50% tariffs on steel and aluminum products from Canada, after a Canadian official withdrewplans for a 25% surchargeon electricity exports to the United States.
On March 12, Canada, the biggest foreign supplier of steel and aluminum to the United States, said it wouldimpose retaliatory tariffson U.S. imported goods worth C$29.8 billion ($20 billion) in response to Trump's steel and aluminum tariffs.
CHINA: Trump levied 10% tariffs across all Chinese imports into the U.S., effective on February 4, following repeated warnings to Beijing about insufficient measures to halt the flow of illicit drugs into the United States.
He followed that up with another 10% duty on Chinese goods, effective March 4, stacking on top of tariffs of up to 25% imposed on Chinese imports during Trump's first term.
China responded by announcingadditional tariffsof 10% to 15% on certain U.S. imports from March 10 and a series of new export restrictions for designated U.S. entities. Later it raised complaints about the U.S. tariffs with the World Trade Organization.
China said on March 12 that it would takeall necessary measuresto safeguard its rights and interests, after U.S. President Donald Trump increased tariffs on all U.S. steel and aluminum imports.
EUROPE: Trump said theEU and other countrieshave troubling trade surpluses with the United States. He has said the countries' products will either be subject to tariffs or he will demand they buy more oil and gas from the U.S., even though U.S. gas export capacity is near its limits.
The European Commission said in a statement on February 14 that it viewed the ""reciprocal"" trade policy as a step in the wrong direction.
Trump has threatened a 25% ""reciprocal"" rate on European goods. Among vulnerable industries is pharmaceuticals, as U.S. firms such as Johnson & Johnson(JNJ.N), opens new taband Pfizer(PFE.N), opens new tabhave large plants in Ireland, which is also a major exporter of medical devices.
The European Union on March 12 said it wouldimpose counter-tariffson 26 billion euros ($28 billion) worth of U.S. goods from next month, in response to blanket U.S. tariffs on steel and aluminum.
On March 13, Trump threatened to slap a200% tariff on European wine and spiritsin response to the EU plan to impose tariffs on American whiskey and other products next month.
AUTOS: On March 26, Trump unveiled a 25% tariff onimported cars and light trucks. The 25% levy would be imposed on top of previous duties on imports of finished vehicles starting on April 3.
Trump's directive included temporary exemptions for auto parts that are compliant with the U.S.-Mexico-Canada Agreement (USMCA) on trade that Trump negotiated during his first term.
Other major automotive parts imports, identified in Trump's proclamation as ""engines and engine parts, transmissions and powertrain parts, and electrical components,"" will be subject to the tariffs on a date to be specified in a Federal Register notice, ""but no later than May 3, 2025.""
METALS: On March 12, Trump increased tariffs onall steel and aluminumimports to 25%, and extended the duties to hundreds of downstream products, from nuts and bolts to bulldozer blades and soda cans.
The U.S. is the world's largest aluminum importer and the second-largest steel importer, with more than half of those volumes coming from Canada, Mexico and Brazil.
Trump on February 25 ordered a new probe into possible new tariffs oncopper importsto rebuild U.S. production of the metal critical in electric vehicles, military hardware, semiconductors and a wide range of consumer goods.
The U.S. produces domestically just over half the refinedcopperit consumes each year.
SEMICONDUCTORS: Trump said tariffs on semiconductor chips would also start at ""25%, or higher,"" rising substantially over the course of a year, but didn't clarify when these will come into effect.
Taiwan Semiconductor Manufacturing Co(2330.TW), opens new tab, the world's largest contract chipmaker, makes semiconductors for Nvidia, Apple and other U.S. clients, and generated 70% of its revenue in 2024 from customers based in North America.
LUMBER: Trump on March 1 ordered a new trade investigation that could heap moretariffs on imported lumber, adding to existing duties on Canadian softwood lumber and 25% tariffs on all Canadian and Mexican goods.
ALCOHOL: Trump on March 13 threatened to slapa 200% tariffon wine, cognac and other alcohol imports from Europe, in response to a European Union plan to impose tariffs on American whiskey and other products next month — which itself is a retaliation to Trump's 25% tariffs on steel and aluminum imports that took effect the day before.",https://www.reuters.com/world/us/all-donald-trumps-tariff-threats-2025-01-28/
"US agency leading Musk's firing spree to hire new driver, emails show","WASHINGTON, March 31 (Reuters) - The federal human-resources agency leading efforts by billionaire White House adviserElon Muskto slash the federal workforce has decided to hire its first new career employee since PresidentDonald Trumptook office, according to emails seen by Reuters.
The position is a new driver to ferry around leaders of that agency, the Office of Personnel Management, the emails indicate.
OPM's acting director, Chuck Ezell, last week authorized an exemption to a government-wide hiring freeze to replace one of two drivers for agency leadership after one retired in mid-March, according to the messages.
The decision, not previously reported, shows thatMusk's Department of Government Efficiency, which is directing the cuts, is not making the government more effective, said Kathleen Clark, a professor of ethics at Washington University in St. Louis.
""It is becoming increasingly obvious that Musk’s & DOGE’s mission has absolutely nothing to do with efficiency, and instead is aimed at enabling Musk to use - and abuse - power within the federal government,"" she said.
""Authorizing a Musk-controlled agency like OPM to hire a driver while slashing essential federal workers who actually help Americans in need is a good example.""
The White House, DOGE, Musk and Ezell did not respond to requests for comment. An OPM spokesperson said in a statement that the agency ""has ongoing security concerns"" requiring a driver, without providing further detail. Ezell said he hasreceived death threats, opens new tabin the role in an interview last month with byFaith, which describes itself as the Magazine of the Presbyterian Church in America.
One of Trump's first acts as president was to create DOGE, to root out waste, fraud and abuse, slash government spending and purge the federal workforce of low-performing, disloyal and unnecessary workers.
Trump has said he is ""very proud"" of what he describes as a vital initiative to turn off the spigot of wasteful spending.
In practice, some sayDOGE has mostly pursued long-time Republican policy objectives, shuttering agencies such as USAID and the Consumer Financial Protection Bureau, which provide a lifeline to the world's needy and protect Americans from unscrupulous lender respectively.
It has also announced drastic cuts at departments that provide critical social services including the Department of Veterans Affairs, which administers healthcare for veterans, and the Social Security Administration, which sends out checks to retired, disabled and widowed Americans.
OPM, which has led the charge on federal government firings, has laid off more than 200 of its own employees and allowed over 400 to opt in to voluntary exit programs since Trump took office, two people familiar with the matter said.",https://www.reuters.com/world/us/us-agency-leading-musks-firing-spree-hire-new-driver-emails-show-2025-03-31/
"Harvard's federal grants, contracts under review over alleged antisemitism, US says","WASHINGTON, March 31 (Reuters) - The Trump administration said on Monday that it was reviewing $9 billion in federal contracts and grants given to Harvard University as part of an ongoing effort to crack down on what it says is antisemitism on college campuses.
The Departments of Education, Health and Human Services and the U.S. General Services Administration said in a written statement that $255.6 million in contracts between Harvard, its affiliates and the federal government were being reviewed, along with $8.7 billion in multi-year grant commitments.
The focus on Harvard comes after the Trump administration this month canceled $400 million in federal funding for fellow Ivy League school Columbia University.
Columbia was the epicenter of anti-Israel protests that broke out on several U.S. college campuses following the Oct. 7, 2023, Hamas attack inside Israel, and Israel's subsequent war in Gaza. The university's interim president announced that she wasstepping downover the weekend.
The Trump administration has blasted universities for not doing enough to combat antisemitism and ensure student safety during the protests.
""Harvard has served as a symbol of the American Dream for generations – the pinnacle aspiration for students all over the world to work hard and earn admission to the storied institution,"" said Secretary of Education Linda McMahon. ""Harvard's failure to protect students on campus from anti-Semitic discrimination - all while promoting divisive ideologies over free inquiry - has put its reputation in serious jeopardy.""
Harvard did not immediately respond to a request for comment.",https://www.reuters.com/world/us/us-reviewing-federal-contracts-grants-harvard-over-antisemitism-allegations-2025-03-31/
"In a change of course, US Justice Dept drops challenge to Georgia voting law","WASHINGTON, March 31 (Reuters) - U.S. President Donald Trump's Justice Department said on Monday it was pulling out of a lawsuit that challenges a Republican-backed Georgia election law as discriminatory, abandoning a position it took under Democratic President Joe Biden.
U.S. Attorney General Pam Bondi said recent increases in Black voter turnout in the battleground state refuted the lawsuit's claim that the 2021 law, whichmandated new voting requirements, amounted to voter suppression.
""Georgians deserve secure elections, not fabricated claims of false voter suppression meant to divide us,"" Bondi said in a statement.
The move was the latest in aseries of actionsby the Justice Department to end Biden-era civil rights actions andshift the focusof the Civil Rights Division to pursue conservative causes.
The law is also being challenged by several civil rights groups including the Georgia chapter of the NAACP, which said it would continue its effort.
""When the government drops the ball and turns a blind eye to injustice, we will step in,"" Gerald Griggs, the president of the Georgia NAACP chapter, told Reuters.
In a 2021 lawsuit,the Justice Department allegedthat the law disproportionately harmed Black voters by limiting absentee ballots and banning the distribution of water or food to people waiting in line at polling places.
Georgia has denied the claims, arguing the law is aimed at securing elections. Brad Raffensperger, a Republican who serves as the state's top elections official, said the Justice Department’s move shows the law “stands on solid legal ground.”
Preliminary data from the 2024 election shows that while the total number of ballots cast by Black voters increased, the turnout gap between white and Black voters grew by about 3% from 2020 to 2024, according to the left-leaning Brennan Center for Justice at New York University School of Law.",https://www.reuters.com/world/us/change-course-us-justice-dept-drops-challenge-georgia-voting-law-2025-03-31/
Union sues to block Trump from ending collective bargaining for many federal workers,"March 31 (Reuters) - A union that represents 150,000 U.S. government employees filed a lawsuit on Monday seeking to block PresidentDonald Trumpfrom stripping hundreds of thousands of federal workers of the ability to collectively bargain with government agencies through their unions.
The National Treasury Employees Union said in the lawsuit filed in Washington, D.C. federal court that Trump'sexecutive order, opens new tablast week exempting more than a dozen agencies from collective bargaining obligations violates federal workers' labor rights and the U.S. Constitution and threatens the union's very existence.
The NTEU said the order applies to more than 100,000 of its 158,000 members and would require agencies to stop deducting union dues from those workers' paychecks, a major blow to the union's revenue and bargaining power.
""The strength and influence of any union correlate directly with the size of its membership,"" the NTEU said.
The NTEU said Trump issued the order to punish unions that have challenged many of his efforts to purge the federal workforce. The union has filed lawsuits over the mass firings of recently-hired federal employees, the shuttering of the U.S. Consumer Financial Protection Bureau, and an attempt to make it easier to fireworkers in policy-related jobs.
The White House did not immediately respond to a request for comment.
On the same day Trump issued the executive order, eight federal agenciesfiled a lawsuitagainst dozens of local union affiliates seeking to invalidate existing union contracts covering thousands of workers.
Eliminating collective bargaining would remove obstacles for agencies to alter working conditions and fire or discipline workers. And it could prevent federal worker unions from challenging Trump administration initiatives in court.
Trump in his order said that exempting large swaths of the federal workforce from collective bargaining was necessary to safeguard national security.
None of the agencies covered by the order are primarily involved in intelligence or national security work, the NTEU said in the lawsuit.
The order was ""instead based on a policy goal of making federal employees easier to fire and political animus against federal sector unions who have opposed the Trump Administration’s initiatives,"" the union said.
The lawsuit seeks a ruling blocking Trump's order and barring federal agencies from complying with it.
Trump in the order excluded from collective bargaining obligations agencies that he said ""have as a primary function intelligence, counterintelligence, investigative, or national security work.""
The order applies to the Justice, State, Defense, Treasury, Veterans Affairs, and Health and Human Services departments, among other agencies. The NTEU on Monday said the order affects 75% of federal workers currently represented by unions.
Trump's order significantly expanded an existing exception from collective bargaining for workers with duties affecting national security, such as certain employees of the CIA and FBI.
The agencies that sued to invalidate union contracts said the Biden administration had entered into many of the agreements in order to impede Trump from carrying out his agenda, including a drastic downsizing of the federal workforce.
The unions that were sued last week by the Trump administration have not yet responded in court, but have said the bargaining agreements are legally binding and that the lawsuit is a meritless attempt to intimidate unions and workers.",https://www.reuters.com/business/world-at-work/union-sues-block-trump-ending-collective-bargaining-many-federal-workers-2025-03-31/
US regulator OCC withdraws guidance to banks for climate-related financial risk,"WASHINGTON, March 31 (Reuters) - The U.S. Treasury Department's Office of the Comptroller of the Currency withdrew principles providing guidance to banks for climate-related financial risk, the financial regulator said on Monday.
Since taking office on January 20, PresidentDonald Trumphasannouncedwithdrawal from the Paris Agreement, canceled U.S. global climate finance and severed international partnerships on climate, including stopping the participation of U.S. scientists in the Intergovernmental Panel on Climate Change.
""The principles providing guidance to banks for climate-related financial risk are overly burdensome and duplicative,"" Acting Comptroller of the Currency Rodney Hood said in a statement.
""I will continue to look for appropriate opportunities to calibrate regulatory requirements to be effective, not excessive, while ensuring the safety, soundness and fairness of the federal banking system.""
Identifying climate risks was one of Democratic former President Joe Biden'skey administration priorities.
Trump, a Republican, has vowed to eliminate many of those, arguing they have created unwanted burden for corporations.
Advocates have raised alarm over Trump's actions.",https://www.reuters.com/sustainability/cop/us-regulator-occ-withdraws-guidance-banks-climate-related-financial-risk-2025-03-31/
House Democrats open probe into FCC media investigations under Trump,"WASHINGTON, March 31 (Reuters) - Three congressional Democrats sought documents on Monday from the head of the Federal Communications Commission as part of a probe into what they called ""sham"" investigations into media outlets including CBS, NBC and ABC launched by the agency under PresidentDonald Trumpto try to intimidate the news media.
The probe was announced by House of Representatives members Frank Pallone, Doris Matsui and Yvette Clarke, who asked FCC chair Brendan Carr to turn over records related to travel with Trump and to the Republican president's Florida residence, and to answer other questions.
Pallone is the top Democrat on the House Energy and Commerce Committee, while Matsui and Clarke are the ranking Democrats on two of its subcommittees. In a letter to Carr, they accused him of launching the investigations into media entities disfavored by Trump and his billionaire adviserElon Musk, seeking ""to target and intimidate news organizations.""
""You have weaponized the agency against news outlets,"" the three Democrats wrote. ""Your pursuit of these actions is clearly intended to punish and burden broadcasters and other media companies by inflicting incalculable reputational harm and excessive costs to defend themselves.""
A spokesperson for Carr, named chair by Trump, said that during Democratic President Joe Biden's administration, ""Democrats repeatedly weaponized our nation's communications laws and processes - including the FCC's own rules."" The spokesperson added that Carr was ""restoring the FCC's commitment to basic fairness and even-handed treatment for everyone.""
Last week, Carr said he wasopening an investigationinto the diversity practices of Walt Disney(DIS.N), opens new taband its ABC unit, saying they may violate U.S. equal employment opportunity regulations. Conservatives have argued that workplace diversity practices discriminate against majority groups including white people.
Carr has sent letters toComcast(CCZ.N), opens new tab, which owns NBC, andVerizon(VZ.N), opens new tabannouncing similar probes into diversity practices.
Days after Carr took over as chair, the FCC reinstated acomplaintover an interview on the CBS program ""60 Minutes"" with then-Vice President Kamala Harris."" The complaint was previously reviewed and dismissed by the FCC.
Trump has sued CBS for $20 billion, claiming that ""60 Minutes"" deceptively edited the interview in order to interfere in the November presidential election in which he defeated Harris, the Democratic candidate.
The three lawmakers said Carr's actions are ""an obvious effort to create additional leverage in Trump's settlement negotiations and encourage payment in a sham lawsuit in exchange for favorable regulatory outcomes.""
CBS, which is owned by Paramount Global(PARA.O), opens new tab, last week called on the FCC to dismiss the complaint ""without delay,"" but Carr rejected the idea. Paramount is currently seeking FCC approval for an $8.4 billion merger with Skydance Media.
Carr in January also reinstated complaints about how ABC News moderated a June 2024 televised debate between Biden and Trump. Biden subsequently dropped out of the race and was replaced by Harris. Carr also reinstated complaints against Comcast's NBC for allowing Harris to appear on the network's ""Saturday Night Live"" program shortly before the election.",https://www.reuters.com/business/media-telecom/house-democrats-open-probe-into-fcc-media-investigations-2025-03-31/
"US NTSB to investigate close call between Delta plane, military jets","WASHINGTON, March 31 (Reuters) - The U.S. National Transportation Safety Board said on Monday it will investigate a close call between a Delta Air Lines(DAL.N), opens new tabplane and a group of Air Force jets near Reagan Washington National Airport last week.
The Delta Airbus A319 received a cockpit collision warning alert that another aircraft was nearby, and controllers issued corrective instructions to both aircraft. The Delta flight had been cleared to depart as four U.S. Air Force T-38 Talons were inbound to nearby Arlington National Cemetery for a flyover.
The U.S. Federal Aviation Administrationsaid on Fridayit would investigate the incident, which occurred earlier that day.
It followed amid-air collisionon January 29 near the same airport involving a passenger jet and a U.S. Army helicopter, which killed 67 people in the first deadly U.S. passenger airline crash in 16 years.
A Delta spokesman on Monday reiterated that the carrier would fully cooperate with the investigations, and that its flight crew had followed procedures to maneuver the aircraft as instructed.
A series of troubling near-miss incidents over the past two years has raised concerns about U.S. aviation safety and the strain on understaffed air traffic control operations.",https://www.reuters.com/world/us/ntsb-investigate-close-call-between-delta-plane-air-force-jets-2025-03-31/
