Title,Text,url
Retired star Richard Sherman says his house was robbed by armed intruders,"March 31 (Reuters) - Retired NFL star defensive back Richard Sherman's house was robbed while his family was at home, the former Super Bowl champion said on social media on Monday, asking for information to catch the perpetrators.
A post on X showed screengrabs of multiple individuals inside the former Seattle Seahawks and San Francisco 49ers cornerback's home, time-stamped to Saturday, a day before Sherman's birthday.
""House being robbed at gun point with my family in it isn't what anyone wants for a birthday gift,"" said Sherman, a five-time Pro Bowl selection and broadcast analyst for Thursday Night Football.
""Scary situation that my wife handled masterfully and kept my kids safe. If anyone has any info that can help find these people please reach out,"" he added.
The incident comes months after theFBI urgedprofessional athletes to take greater precautions following a string ofbreak-insat the homes of high-profile players, with the residence of twice NFL MVP Patrick Mahomes among the targets.
U.S. prosecutorslast monthunveiled criminal charges against seven suspected members of a Chilean theft ring accused of breaking into the homes of professional athletes while they were playing games. Some were caught with memorabilia stolen from the home of Cincinnati Bengals quarterback Joe Burrow.",https://www.reuters.com/world/us/retired-star-richard-sherman-says-his-house-was-robbed-by-armed-intruders-2025-03-31/
