Title,Text,url
Blue Origin targets late spring for next New Glenn launch after FAA probe,"WASHINGTON, March 31 (Reuters) - Jeff Bezos' Blue Origin said on Monday it is targeting ""late spring"" for the second launch of its giant New Glenn rocket, as the U.S. FAA closed an investigation into the rocket's landing failure that followed an otherwise successful debut mission in January.
The two-stage New Glenn rocketlaunched for the first timein January after years of development delays and successfully placed a satellite in orbit. But afterward, the rocket's reusable first-stage booster failed in its landing attempt on a vessel in the Atlantic Ocean, triggering an FAA probe.
Blue Origin said in a statement on Monday that the landing failure was ""due to our three BE-4 engines not re-igniting properly,"" without providing further technical detail.
The company said its investigative report into the landing failure ""identified seven corrective actions, focusing on propellant management and engine bleed control improvements, which we’re already addressing.""
""We expect to return to flight in late spring and will attempt to land the booster again,"" Blue Origin said.
A statement on Monday from the FAA, which oversees U.S. launch safety matters, confirmed the closing of its review of Blue Origin's technical probe, saying, ""The FAA will verify that Blue Origin implements corrective actions prior to the launch of the New Glenn-2 mission.""
Blue Origin's New Glenn debut was the company's first step into Earth's orbit, a pivotal moment for Bezos' space ambitions as he tries to compete withElon Musk'sSpaceX on multiple fronts - from satellite launches to moon landings to lucrative Pentagon contracts for secretive military space operations.
Weeks after New Glenn's first launch, Blue Origin CEO Dave Limplaid off 10 percentof the company's 14,000 employees in a move to cut costs and shift New Glenn unit's focus on rocket production and a swift launch cadence.",https://www.reuters.com/business/autos-transportation/blue-origin-targets-late-spring-next-new-glenn-launch-after-faa-probe-2025-03-31/
Big Tobacco targets Trump in hope - and fear - of change,"LONDON, March 31 (Reuters) - Big tobacco companies like British American Tobacco are lobbying U.S. President Donald Trump's administration to crack down on illegal vapes, including via import bans on Chinese devices, documents show and industry consultants said.
Tobacco groups, including BAT(BATS.L), opens new taband Altria(MO.N), opens new tab, have complained that while waiting years for their own vapes or other products to get permission for sale in the U.S., some vape makers have taken substantialmarket shareeven though authorities say they are illegal to sell.
Despite efforts to stem the flow of unauthorised vapes, they currently dominate the market. BAT estimated last year that unauthorised disposable vapes account for around 70% of almost 10 billion pounds ($12.93 billion) worth of U.S. vape sales annually. Tobacco companies say this has hit their own vape and cigarette sales.
U.S. authorities have said these unauthorised vapes, including productsmadeby Chinese firms, are illegal to import into the U.S. or sell there.
BAT and Altria haveexpressed optimismthat Trump's government will address these issues.
BAT's U.S. subsidiary Reynolds American wrote to the Office of the United States Trade Representative on March 11 to call for the government to ban imports of all disposable vapes from China and consider additional tariffs on any other Chinese-made e-cigarettes and smoking alternatives.
""The Chinese companies' unfair and illegal trading practices harm Reynolds and other law-abiding U.S. companies,"" Reynolds wrote in the letter, published by the USTR. The letter has not previously been reported.
Asked about the letter, a Reynolds spokesperson said only products that follow FDA policies and procedures should remain on the market.
The stakes are high for tobacco companies. Changes that deliver more robust enforcement of the rules governing vapes and other smoking alternatives could help them protect their market share in U.S. nicotine consumption even as tobacco use falls.
But any shift that removed or lowered legal and regulatory obstacles for currently unauthorised vapes could accelerate their growth further.
Big tobacco and vape companies want the FDA's authorisation process to be faster and clearer, but not necessarily more wholesale change, two industry consultants told Reuters.
White House press secretary Karoline Leavitt said President Trump makes decisions in the best interests of the American public.
Tobacco companies, as well as vape makers, are battling to get the ear of relevant U.S. leaders or officials to make the case for changes they would support, a total of three industry consultants said. They asked not to be identified in order to speak freely.
""It's no secret that everyone with a stake in this issue is trying to access the White House,"" said one of the consultants, who works for a tobacco company.
Reynolds donated $10 million to Trump-aligned super PAC Make America Great Again Inc, Federal Electoral Commission filings show.
BAT said it engages with lawmakers across the political spectrum and advocates for policies that help transition smokers to alternatives regardless of who is in the White House.
Brian Ballard, president of Ballard Partners, a lobbying firm employed by Reynolds since 2017, according to official lobbyist filings, chaired the Florida Finance Committee for Trump during his 2016 campaign.
His firm also previously employed Susie Wiles, Trump's current White House Chief of staff, and U.S. Attorney General Pam Bondi, lobbyist filings show.
The Department of Justice did not respond to questions on Bondi's link to Ballard Partners. Ballard Partners declined to comment.
Wiles has not had any contact with Ballard Partners or BAT since January, a senior White House official told Reuters.
The FDA has been criticised by companies and some lawmakers for slow product authorisations and for failing to address the widespread trade in unauthorised products. The agency has said it needs moreresourcesto tackle these challenges.
Tobacco industry executives are concerned that the FDA's Center for Tobacco Products could be gutted or axed if the administration concludes it has failed, the consultant working for a tobacco company said.
CTP has already been targeted forcutsand could be affected by plans to restructure federal public health agenciesannouncedlast week.
The FDA has so far authorised only 34 tobacco and menthol-flavoured vape products for sale.
Reynolds said there was an ""urgent need"" to revisit how new products come to market, but it embraces FDA action to review and authorise them.
Altria pointed Reuters to remarks by CEO William Gifford, who told investors in February Altria wants quicker product authorisations and proper enforcement against illicit products.
The head of the Vapor Technology Association, Tony Abboud, however said the current system creates a steep barrier for entry and had essentially outlawed flavoured vapes that can help smokers quit.
A significant change of approach was needed, Abboud told Reuters.
The association says it represents ""industry-leading manufacturers of vapor devices, e-liquids, and flavorings, distributors and suppliers, as well as retailers.""
Abboud met with Trump in 2024. Afterwards, in September 2024, Trump posted on Truth Social pledging to ""save"" vaping.
($1 = 0.7733 pounds)",https://www.reuters.com/business/healthcare-pharmaceuticals/big-tobacco-targets-trump-hope-fear-change-2025-03-31/
Insight: How the Trump family took over a crypto firm as it raised hundreds of millions,"LONDON/NEW YORK, March 31 (Reuters) - As World Liberty Financial raised more than half a billion dollars, President Donald Trump’s family took control of the crypto venture and grabbed the lion’s share of those funds, aided by governance terms that industry experts say favor insiders.
Launched last fall, World Liberty’s goal is to allow people to access financial services using cryptocurrencies and without intermediaries like banks in what is called decentralized finance, or DeFi. But it has yet to launch a public platform and has reported only a small staff, a review of the project shows.
Even so, World Liberty said in mid-March it had raised $550 million selling so-called governance tokens. Most of those sales took place after Trump’s election win in November, Reuters calculations show.
The tokens, which go by the symbol $WLFI, give holders the right to vote on changes to the project’s underlying code and to signal their opinion on its direction and plans. They cannot be traded.
As its fundraising got traction, World Liberty disclosed in January that the Trump family had taken control of the business, a review of changes in the fine print on World Liberty’s website shows. Two of its co-founders, crypto entrepreneurs Zak Folkman and Chase Herro, were replaced as the controlling parties of World Liberty by an entity in which the Trump family holds a 60% stake.
The changes have not been previously reported.
Overall, the Trump family now has a claim on 75% of net revenues from token sales and 60% from World Liberty operations once the core business gets going. The arrangement means the Trump family is currently entitled to about $400 million in fees. After World Liberty's co-founders take their cut, the crypto venture will be left with 5% of the $550 million raised to date to build the platform, according to Reuters calculations.
The arrangements, including the Trump family’s large share of the project’s revenues and the non-tradeable nature of the governance tokens, make World Liberty unusually centralized for the industry, according to a survey of the practices of the five largest DeFi lending platforms and interviews with four U.S. academics who study the crypto industry.
""It's hard for me to see any economic benefit to the owner of these tokens,"" said Jim Angel, an associate professor at Georgetown University who has written about DeFi regulation.
David Krause, a longtime finance professor at Marquette University in Milwaukee who recently published a study of World Liberty, said that the structure of the project “pretty much excludes public investors or token holders from any meaningful financial participation.”
A White House spokesperson referred questions about World Liberty to the Trump Organization. The Trump Organization's chief legal officer and the president's two older sons, who are executives at the company, did not respond to requests for comment.
The Trump Organization announced in January that the president's investments, assets and business interests would be held in a trust managed by his children and he would play no role in day-to-day operations or decision-making. The family's business also retained an attorney to serve as an ethics adviser to ""avoid any perceived conflicts of interest.""
Folkman and Herro did not reply to Reuters questions in person and in writing. In a post on social media platform X on March 14, World Liberty said it “is a DeFi project with a tremendous mission to build and democratize a new financial system for the benefit of millions.”
At a conference in February, Herro said the plan was to open crypto investing to everyday Americans such as teachers, dentists and firemen. His business partner, Donald Trump Jr, the president's son, has complained about the family being excluded from traditional banking in the aftermath of his father's first term.
The Trump family’s investment in World Liberty ties the personal fortunes of a sitting U.S. president to an asset class that sits at the outer edges of both risk and regulation.
Trump has promised to be the “crypto president,” who will popularize its mainstream use in America. He has said he backs crypto because it can improve the banking system and increase the dominance of the U.S. dollar.
At the same time, the Trump family, long rooted in skyscrapers and country clubs, has opened beachheads in crypto, quickly gaining hundreds of millions of dollars. A so-called meme coin promoted by Trump has generated at least $349 million in fees for entities connected to the president, according to crypto data firm Chainalysis.
On Monday, the Trump family deepened its crypto interests, as a company formed with the president's elder sons, Eric and Donald Trump Jr., took a minority stake in a newly-formed bitcoin producer called American Bitcoin. Eric Trump will become the chief strategy officer of the new firm, which will focus on mining bitcoin and aims to become publicly listed, the statement said.
The prospect of Trump and his family benefiting from deregulation has drawn criticism from hispolitical opponentsand some government ethics experts who say it creates the potential for conflicts of interest and influence peddling.
""You've got the guy in charge who is responsible for his own regulation,"" said Ross Delston, a former U.S. banking regulator who has acted as an expert witness on anti-money laundering issues for the government.
Delston also pointed to the potential for people buying $WLFI tokens to earn political favor. It would be “the perfect vehicle,” he said, for governments or oligarchs overseas “to funnel money to the president.""
World Liberty has attracted well-heeled buyers: Almost 70% of the money raised came from wallets that spent at least $100,000, and more than 50% was buys of $1 million or more, according to a Reuters analysis of publicly available information on transactions.
While buyers of $WLFI gave their names to the venture, the identity of nearly all of those big spenders is hidden from public view by anonymous crypto wallets. Among ahandful of buyers that Reuters was able to identify,several said they bought into the token because they believed Trump’s involvement would help it succeed as a business.
World Liberty’s beginnings lie in the convergence of two obscure figures on the crypto scene and some of the most powerful people in American politics.
Folkman and Herro entered Trump circles via the family of New York real estate mogul Steve Witkoff, a longtime Trump friend who is now also his envoy to the Mideast.
The two crypto entrepreneurs had already collaborated on several companies together focused on making money from online ventures. Their business background includes past instances of dissolution, litigation and unpaid debts, according to corporate records, state filings and U.S. court documents. Early in his career, Folkman offered seminars on how to “date hotter girls.”
Steve Witkoff said he was introduced to the pair by one of his sons, when speaking about how the deal came together on a crypto podcast hosted in September by the Trump family.
After meeting the two crypto businessmen and hearing them speak about the difficulties of getting credit in traditional finance, Witkoff said he thought of the Trumps. He set up a meeting with Donald Trump and his two oldest sons for Herro and Folkman to describe the opportunities of DeFi. The Trumps, Witkoff said, were smitten: “We said, ‘Let’s go pursue it.’”
Witkoff did not respond to requests for comment.
Despite Trump’s backing, token sales were slow at first. According to a U.S. regulatory filing by the company dated October 30 - around two weeks after World Liberty sales had begun - the venture’s total amount sold was only $2.7 million.
Then, on November 25, less than three weeks after Trump won the U.S. election, Justin Sun, a Hong Kong-based crypto entrepreneur who was fighting a U.S. securities fraud lawsuit, announced that he’d sunk $30 million into $WLFI - the amount the company said it needed to jumpstart operations.
“His amount was pretty meaningful at that point,” said “Ogle”, a World Liberty security adviser who only goes by that pseudonym and has appeared in video interviews with his face obscured by a bandana and sunglasses.
Sun has said his investment has since risen to $75 million. As well as its single-largest known investor, he has become an advisor to the project. Meanwhile, the U.S. Securities and Exchange Commission in February paused its case against him, citing public interest.
Sun didn’t respond to a request for comment. The SEC declined to comment.
Initially, Herro and Folkman were listed as the “sole directors and members” of World Liberty Financial Inc, the main entity developing the platform, according to World Liberty’s terms and conditions, last updated in October.
On January 19 and 20 - the day of Trump’s inauguration - World Liberty raised almost $300 million in a frenzy of token sales, according to a Reuters analysis of blockchain data. Around that time, its website was updated to say WLF Holdco LLC now controlled World Liberty Financial Inc. And DT Marks DeFi LLC – Trump’s company – now held about 60% of WLF Holdco. It did not disclose who owns the rest.
The president’s son, Eric, also gained a seat on WLF Holdco’s board of managers.
Reuters could not ascertain the terms of any deals between Trump and his partners that led to the changes.
Angel, the Georgetown professor, said the corporate structure had put several layers of entities between Trump and World Liberty, protecting the president from any potential legal action should something go wrong. “He can say: ‘You can't sue me because I'm not involved’,” Angel said.
The five largest DeFi lending platforms, as ranked by data site DefiLlama, all have governance tokens that give holders voting rights. But unlike World Liberty, those five platforms either allocated the majority of their governance tokens to be given away for free to users, sold them to venture capitalists in return for money to build the platform, or paid them to partners in return for building the project.
World Liberty governance tokens lack another critical feature of those issued by other DeFi platforms – the ability of token holders to vote for the platform to pay them a share of its profits. World Liberty has told token holders any vote to breach its existing deals with Trump and other backers would have no force, according to a 13-page description of the business released in October.
Folkman told a New York audience on March 18 that the company is working on three main products, including a “lend and borrow” market that would be announced soon and a personal finance application. World Liberty also said in March that it is planning tolaunch a stablecoin, known as USD1, that will be backed by assets such as U.S. Treasuries and redeemable for a dollar.
One company that World Liberty has collaborated with is Ondo Finance. The startup, founded in 2021 by former Goldman Sachs employees, lets users buy blockchain-based tokens backed by U.S. Treasuries and other assets such as money market funds, thereby earning interest. The two companies said in a statement that they would collaborate to “advance the adoption of tokenized real-world assets.”
“They're all in early stages, but we're exploring what they're doing at a very high level,” Nathan Allman, Ondo’s CEO, told Reuters.
While World Liberty has also used some of the money it raisedto invest in other cryptocurrencies, it has yet to launch a DeFi platform.
Two software developers listed on World Liberty's website are based in Romania, according to their social media profiles. Octavian Lojnita was previously a developer at Dough Finance, a Herro and Folkman project that collapsed last year after being hacked, according to Lojnita's online profile and the publicly available source code of Dough. The online handle for a second developer at Dough matches that of Bogdan Purnavel, also at World Liberty.
Lojnita declined to discuss his involvement in World Liberty. Purnavel referred questions to World Liberty.
The coding for contracts posted to the project’s blockchain – a public-facing database – shows that World Liberty “appears to still be in development, with several functionalities not yet implemented or fully operational,” according to a review in late March by CertiK, a cybersecurity company that audits projects for security flaws.",https://www.reuters.com/business/finance/how-trump-family-took-over-crypto-firm-it-raised-hundreds-millions-2025-03-31/
Lockheed Martin clinches $4.94 billion US Army missile contract,"March 31 (Reuters) - Lockheed Martin(LMT.N), opens new tabon Monday said the U.S. Army had awarded it a contract worth up to $4.94 billion to produce Precision Strike Missiles (PrSM).
Defense companies are seeing a surge in weaponry demand, driven by conflicts across the globe.
The Pentagon has been prioritizing purchases of thePrSM, which is to replace the Army Tactical Missile (ATACM).
PrSM is Lockheed's next-generation long-range precision strike missile, capable of neutralizing targets beyond 400 kilometers.
Shares of the defense giant rose more than 1% in afternoon trade.
The news of the company securing the army's indefinite delivery/indefinite quantity contract comes after U.S. President Donald Trump earlier this month awarded the U.S. Air Force's fighter jetcontractworth more than $20 billion to Boeing(BA.N), opens new tabreplacing Lockheed's F-22 Raptor.",https://www.reuters.com/business/aerospace-defense/lockheed-martin-clinches-494-billion-us-army-missile-contract-2025-03-31/
"Democratic senators urge Trump to revamp China trade ties, revise free trade deals","WASHINGTON, March 31 (Reuters) - Three Democratic senators on Monday urged U.S. PresidentDonald Trumpto ""dramatically revise"" the United States' trade relationship with China along with 14 free trade agreements, providing a boost to his push to revamp U.S. trade policy.
In a letter to the Republican president, Senators Tammy Baldwin of Wisconsin and Gary Peters and Elissa Slotkin of Michigan welcomed the comprehensive review of trade policy Trump has ordered and his push to rebuild the U.S. manufacturing base.
Trump has upended U.S. trade policy and unsettled financial markets with a series oftariffsaimed at competitors like China and neighbors like Canada and Mexico and specific sectors like autos and metals. He plans to announce more tariffs aimed atall countrieswith big trade surpluses on Wednesday.
The policies have sparked criticism from free trade groups and some firms, but also support from unions and some Democratic lawmakers, underscoring the bipartisan nature of concerns over the loss of 4.3 million manufacturing jobs since 2001.
The Democratic senators said changes were urgently needed after what they called flawed trade decisions made by Democrats and Republicans on trade ties with China and other countries, while calling on Trump to keep the needs of workers in mind.
""Free trade and globalization have left us with offshored manufacturing, devastated communities, workers out of a job or in jobs with lower wages, and supply chains overly dependent on our adversaries in too many areas,"" they wrote, noting that their states had suffered disproportionately.
The senators urged Trump to focus on a ""pro-American worker trade policy"" by rethinking a 2000 decision to grant China permanent normal trade relations status, which paved the way for its entry into the World Trade Organization.
The Trump administration should also rethink its 14 free trade deals with 20 countries, including the U.S.-Mexico-Canada Agreement and take steps to strengthen trade enforcement mechanisms, including through ending a trade rule called ""de minimis"" that allows goods valued at less than $800 to enter the country duty-free and with minimal inspections.
Trump ordered the end of the loophole,which allowed nearly 1.4 billion packages to enter the U.S. last year, but quickly paused it due to logistical issues.
The senators said they viewed Trump's favored instrument of tariffs as an important tool for leveling the playing field, but noted that it could take years to impact supply chains.
To ensure the tariffs worked, the administration also needed to make investments, enact Buy America requirements and tax incentives, like those in the Inflation Reduction Act passed under former President Joe Biden that Trump has vowed to undo.
Steps were also needed to keep corporations in check with equitable tax rates and strong antitrust laws, and empowering workers to join unions, they said.",https://www.reuters.com/world/us/democratic-senators-urge-trump-revamp-china-trade-ties-revise-free-trade-deals-2025-03-31/
